{
  "id": "PAT-101",
  "alegacoes_relacionadas": ["ALG-101"],
  "ambiente": "Área fictícia A",
  "localizacao_detalhada": null,
  "sistema": "Sistema fictício A",
  "constatacao": {"situacao": "CONFORME", "descricao": "Condição conforme fictícia.", "extensao": null, "metodo": ["INSPECAO_VISUAL"], "evidencias": ["OBS-101"], "fotografias": []},
  "analise_causal": {"causa_provavel": null, "causas_alternativas": [], "fundamentos": [], "limitacoes": [], "grau_certeza": "NAO_APLICAVEL"},
  "origem": "NAO_APLICAVEL",
  "criticidade": "NAO_APLICAVEL",
  "vicio_construtivo": {"caracterizado": false, "tipo": "NAO_APLICAVEL", "fundamentacao": null, "validado_perito": false},
  "normas_relacionadas": [],
  "consequencias": {"seguranca": null, "funcionalidade": null, "estanqueidade": null, "salubridade": null, "higiene": null, "durabilidade": null, "conforto": null, "estetica": null, "manutencao": null, "evolucao": null},
  "recomendacao": {"necessaria": true, "descricao": "Serviço fictício indevidamente orçado.", "extensao": "1 un"},
  "orcamento": {"incluir": true, "justificativa": "Caso negativo fictício.", "quantitativo": 1, "unidade": "un", "memoria_calculo": "1 unidade fictícia.", "validado_perito": true},
  "redacao": {"analise_alegacoes_causas": "Análise fictícia.", "consequencias": null, "classificacao": "Conforme.", "conclusao": "Condição conforme fictícia."},
  "status_validacao": "PENDENTE_PERITO"
}
