{
  "id": "PAT-002",
  "alegacoes_relacionadas": ["ALG-002"],
  "ambiente": "Cozinha",
  "localizacao_detalhada": null,
  "sistema": "Revestimento fictício",
  "constatacao": {
    "situacao": "CONFORME",
    "descricao": "Não foi observada alteração na superfície examinada.",
    "extensao": null,
    "metodo": ["INSPECAO_VISUAL"],
    "evidencias": ["OBS-002"],
    "fotografias": []
  },
  "analise_causal": {
    "causa_provavel": null,
    "causas_alternativas": [],
    "fundamentos": [],
    "limitacoes": [],
    "grau_certeza": "NAO_APLICAVEL"
  },
  "origem": "NAO_APLICAVEL",
  "criticidade": "NAO_APLICAVEL",
  "vicio_construtivo": {
    "caracterizado": false,
    "tipo": "NAO_APLICAVEL",
    "fundamentacao": null,
    "validado_perito": false
  },
  "normas_relacionadas": [],
  "consequencias": {
    "seguranca": null,
    "funcionalidade": null,
    "estanqueidade": null,
    "salubridade": null,
    "higiene": null,
    "durabilidade": null,
    "conforto": null,
    "estetica": null,
    "manutencao": null,
    "evolucao": null
  },
  "recomendacao": {
    "necessaria": false,
    "descricao": null,
    "extensao": null
  },
  "orcamento": {
    "incluir": false,
    "justificativa": "Situação conforme não produz item.",
    "quantitativo": null,
    "unidade": null,
    "memoria_calculo": null,
    "validado_perito": false
  },
  "redacao": {
    "analise_alegacoes_causas": "A alegação fictícia foi confrontada com a observação.",
    "consequencias": null,
    "classificacao": "Situação conforme; origem e criticidade não aplicáveis.",
    "conclusao": "A alegação fictícia não foi confirmada na área examinada."
  },
  "status_validacao": "PENDENTE_PERITO"
}
